{"status":"blocked","judgment":"blocked","observation":"Provider infrastructure failed before producing expedition state, screenshot artifacts, or player telemetry.","trend":"No trend is established; this is the first call.","reasoningSummary":"No authoritative game frame or expedition phase is available, so progress and encounter-directed action cannot be judged without fabricating evidence.","evidence":["processStatus=failed","reportStatus=blocked","expedition=null","artifacts=[]","playerPosition=null"],"historyCallIds":[],"nextActionProfile":"forward","nextHypothesis":"Retry the live session to obtain an authoritative expedition frame.","confidence":1,"stopReason":"Provider infrastructure failed before a game state was returned."}