{"status":"blocked","judgment":"blocked","observation":"Provider infrastructure failed again before producing expedition state, screenshot artifacts, or player telemetry.","trend":"Repeated infrastructure failure across call-0001, call-0002, and call-0003; no authoritative game progress is established.","reasoningSummary":"The current report is blocked with processStatus=failed, expedition=null, no artifacts, and no player position, so expedition progress and encounter-directed action cannot be judged without fabricating evidence.","evidence":["processStatus=failed","reportStatus=blocked","expedition=null","artifacts=[]","playerPosition=null"],"historyCallIds":["call-0001","call-0002"],"nextActionProfile":"forward","nextHypothesis":"Retry the live session to obtain an authoritative expedition frame.","confidence":1,"stopReason":"Provider infrastructure failed before producing an authoritative game report."}