{"status":"continue","judgment":"partially-confirmed","observation":"The Still Guest remains approaching on the right with bearingRadians=0.571 and beamContact=false. The prior right turn improved alignment from 1.743 to 0.571 without movement; the encounter is not yet repelled.","trend":"Successive right turns are steadily reducing the positive bearing toward beam alignment, but contact has not yet occurred and visual luminance remains unreadable.","reasoningSummary":"State evidence supports another bounded right turn because the encounter remains active, right-sided, and not in beam contact. Holding the beam now is premature while beamContact is false; screenshots cannot provide reliable primary confirmation.","evidence":["expedition.phase=exploring","activeEncounter.id=encounter-1-still-guest","activeEncounter.state=approaching","activeEncounter.bearingRadians=0.5714472760764076","activeEncounter.distance=9.31597499999996","activeEncounter.beamContact=false","activeEncounter.beamHoldMs=0","audioCue.pan=0.363794634815837","movementDelta=0","prior bearingRadians=1.7434537760764082","reportStatus=failed","luminance.readable=false"],"historyCallIds":["call-0003"],"nextActionProfile":"turn-right","nextHypothesis":"A final bounded right turn should bring the Still Guest within the flashlight beam; then hold-beam should be attempted when beamContact becomes true or bearing approaches zero.","confidence":0.95,"stopReason":null}