{"status":"stop","judgment":"confirmed","observation":"The expedition authoritatively reports phase=caught. The Still Guest completed its jumpscare and the run ended with the player caught.","trend":"The encounter regressed from last-chance with the beam restored to jumpscare and caught without beam contact; no encounters were survived.","reasoningSummary":"The current authoritative expedition phase is caught, so the harness stopping condition is satisfied. Supporting evidence shows activeEncounter.state=jumpscare, fullScareWitnessed=true, beamContact=false, and lastEvent confirms capture.","evidence":["expedition.phase=caught","activeEncounter.state=jumpscare","activeEncounter.fullScareWitnessed=true","activeEncounter.beamContact=false","lastEvent=Caught by The Still Guest after 0 survived encounters.","reportStatus=passed"],"historyCallIds":["call-0006"],"nextActionProfile":"hold-beam","nextHypothesis":"No further action; the expedition has ended authoritatively in the caught phase.","confidence":1,"stopReason":"Authoritative expedition phase is caught."}