{"status":"continue","judgment":"partially-confirmed","observation":"The expedition remains exploring with the first encounter approaching. The Still Guest is strongly to the right (positive bearing 2.92) and has not contacted the beam.","trend":"An encounter has emerged after forward progress; movement continued, but screenshot luminance readability regressed versus the prior episode.","reasoningSummary":"Forward movement correctly advanced into Building 1, but the active encounter now requires turning toward the positive right-side bearing before holding the beam. The failed report and reduced luminance limit visual confirmation, while debug state still supports a bounded turn-right response.","evidence":["expedition.phase=exploring","activeEncounter.id=encounter-1-still-guest","activeEncounter.state=approaching","activeEncounter.bearingRadians=2.9200207760764085","activeEncounter.beamContact=false","activeEncounter.distance=16.773179999999986","previous call had activeEncounter=null and reportStatus=passed","current reportStatus=failed","current luminance.readable=false"],"historyCallIds":["call-0001"],"nextActionProfile":"turn-right","nextHypothesis":"Turning right will bring the Still Guest's positive bearing within the flashlight beam so the next action can hold the beam.","confidence":0.94,"stopReason":null}