{"status":"blocked","judgment":"blocked","observation":"Provider infrastructure failed again before producing expedition state, screenshot artifacts, or player telemetry.","trend":"Repeated infrastructure failure across call-0001 and call-0002; no authoritative game progress is established.","reasoningSummary":"The current report is missing and processStatus=failed, so expedition phase and encounter direction cannot be judged without fabricating evidence.","evidence":["processStatus=failed","reportStatus=missing-report","expedition=null","artifacts=[]","playerPosition=null"],"historyCallIds":["call-0001"],"nextActionProfile":"forward","nextHypothesis":"Retry the live session to obtain an authoritative expedition frame.","confidence":1,"stopReason":"Provider infrastructure failed before producing authoritative expedition evidence."}