{"status":"continue","judgment":"inconclusive","observation":"The expedition is exploring with no active encounter; the intro is complete and movement is progressing toward the next encounter.","trend":"No trend established; this is the first call.","reasoningSummary":"Forward movement is appropriate because the game reports exploring, no active encounter, and 4.9 meters traveled since the entrance versus 7 meters to the next encounter. No encounter response is required yet.","evidence":["expedition.phase=exploring","expedition.activeEncounter=null","expedition.distanceSinceEncounter=4.9032","expedition.nextEncounterInMeters=7","expedition.introDistanceTravelled=12.4128","report.reportStatus=passed"],"historyCallIds":[],"nextActionProfile":"forward","nextHypothesis":"Continue forward until an encounter cue or authoritative caught phase appears.","confidence":0.99,"stopReason":null}